{"$id":"https://schemas.opengamevcs.dev/chunking/v1/selection-benchmark-thresholds.schema.json","$schema":"https://json-schema.org/draft/2020-12/schema","additionalProperties":false,"properties":{"entries":{"items":{"additionalProperties":false,"properties":{"id":{"maxLength":128,"minLength":1,"pattern":"^[a-z0-9][a-z0-9-]*$","type":"string"},"metric":{"enum":["workloadCount","successCount","accountingMismatchCount","reusedBytes","newlyRequiredBytes","resynchronizationDistanceBytes"]},"operator":{"enum":["maximum","minimum"]},"requirementId":{"maxLength":20,"minLength":15,"pattern":"^OGVCS-[0-9]{3}-(?:FR|NFR|AC)-[0-9]{2}$","type":"string"},"severity":{"enum":["gate","warning"]},"value":{"maximum":9007199254740991,"minimum":0,"type":"integer"},"workloadId":{"maxLength":64,"minLength":1,"pattern":"^[a-z][a-z-]*|\\*$","type":"string"}},"required":["id","requirementId","workloadId","metric","operator","value","severity"],"type":"object"},"maxItems":64,"minItems":1,"type":"array"},"owner":{"const":"ogvcs-007"},"profile":{"const":"chunking.opengamevcs/gear-fastcdc-1m@1"},"schemaVersion":{"const":"ogvcs.chunking/selection-benchmark-thresholds/v1"},"version":{"const":1},"x-ogvcs-license":{"const":"MIT"}},"required":["schemaVersion","profile","version","owner","entries","x-ogvcs-license"],"title":"ChunkingSelectionBenchmarkThresholds","type":"object","x-ogvcs-license":"MIT"}
