{"entries":[{"id":"all-seven-workloads-present","metric":"workloadCount","operator":"minimum","requirementId":"OGVCS-007-FR-08","severity":"gate","value":7,"workloadId":"*"},{"id":"all-seven-workloads-succeed","metric":"successCount","operator":"minimum","requirementId":"OGVCS-005-FR-02","severity":"gate","value":7,"workloadId":"*"},{"id":"all-byte-accounting-balances","metric":"accountingMismatchCount","operator":"maximum","requirementId":"OGVCS-007-NFR-03","severity":"gate","value":0,"workloadId":"*"},{"id":"source-like-retains-material-reuse","metric":"reusedBytes","operator":"minimum","requirementId":"OGVCS-007-FR-08","severity":"warning","value":4000000,"workloadId":"source-like"},{"id":"structured-retains-material-reuse","metric":"reusedBytes","operator":"minimum","requirementId":"OGVCS-007-FR-08","severity":"warning","value":14000000,"workloadId":"structured"},{"id":"compressed-observes-poor-reuse","metric":"reusedBytes","operator":"maximum","requirementId":"OGVCS-007-AC-04","severity":"warning","value":262144,"workloadId":"already-compressed"},{"id":"random-observes-no-reuse","metric":"reusedBytes","operator":"maximum","requirementId":"OGVCS-007-AC-04","severity":"warning","value":0,"workloadId":"encrypted-random"},{"id":"insertion-resynchronizes-boundedly","metric":"resynchronizationDistanceBytes","operator":"maximum","requirementId":"OGVCS-007-AC-04","severity":"warning","value":1048576,"workloadId":"insertion"},{"id":"replacement-resynchronizes-boundedly","metric":"resynchronizationDistanceBytes","operator":"maximum","requirementId":"OGVCS-007-AC-04","severity":"warning","value":1572864,"workloadId":"replacement"},{"id":"append-limits-new-tail-bytes","metric":"newlyRequiredBytes","operator":"maximum","requirementId":"OGVCS-007-FR-08","severity":"warning","value":2097152,"workloadId":"append"}],"owner":"ogvcs-007","profile":"chunking.opengamevcs/gear-fastcdc-1m@1","schemaVersion":"ogvcs.chunking/selection-benchmark-thresholds/v1","version":1,"x-ogvcs-license":"MIT"}
